{
  "artifact_type": "car-price-calculator.static-model",
  "bounds": {
    "mileage": [
      100,
      194043
    ],
    "price": [
      8999.0,
      229918.0
    ],
    "rating": [
      0,
      5
    ],
    "year": [
      2014,
      2024
    ]
  },
  "dataset": {
    "creator": "Danish Ammar",
    "license": "Apache-2.0",
    "local_sha256": "2130df035c08d2a1de71fa9a662f7deb14d54263f760fd57ed47176143c67c5b",
    "note": "The checked-in CSV is a transformed copy with Name and Mileage split into fields.",
    "rows": 2429,
    "source_last_updated": "2024-04-26",
    "source_url": "https://www.kaggle.com/datasets/danishammar/usa-mercedes-benz-prices-dataset",
    "source_version": 1,
    "title": "USA Mercedes Benz Prices Dataset"
  },
  "defaults": {
    "mileage": 36000,
    "model": "GLC 300",
    "rating": 4.6,
    "year": 2022
  },
  "evaluation": {
    "mae_usd": 8589.36,
    "method": "Single deterministic grouped 80/20 holdout; identical feature vectors stay together (random_state=42)",
    "r2": 0.799948,
    "rmse_usd": 14570.38,
    "test_rows": 490,
    "train_rows": 1939
  },
  "limitations": [
    "Saved listing snapshot; not live market data.",
    "Asking prices are not verified sale prices.",
    "Dealer rating is not a vehicle-condition score.",
    "The static Ridge model differs from the Flask Random Forest.",
    "A single grouped holdout does not establish performance over time or on unseen models."
  ],
  "model": {
    "alpha": 10.0,
    "features": [
      "Year",
      "Mileage",
      "Rating",
      "Model"
    ],
    "intercept": 67597.5348342,
    "method": "Ridge regression",
    "model_coefficients": [
      -2828.344892,
      -12355.74712839,
      -19912.54653787,
      -23447.76776891,
      -8187.45597846,
      -2372.26517186,
      -9936.93125757,
      -2975.77892782,
      4038.50231074,
      -1815.49611539,
      -13654.25189142,
      -3238.8142756,
      -2327.79061975,
      -252.96530462,
      309.33623326,
      223.69527336,
      -658.1741076,
      -1325.56215316,
      6444.72336383,
      15271.9770077,
      31.37236785,
      777.98134422,
      3716.94079783,
      4547.72788296,
      71609.11939292,
      98761.56731754,
      -12680.44281455,
      -2615.3958735,
      -13308.70692163,
      -1782.85795575,
      -12669.6043058,
      -1826.88615458,
      -9919.14931195,
      -3585.03076656,
      -410.70092172,
      275.56449334,
      -695.45077948,
      -1304.56030799,
      -357.04147729,
      -86.82019237,
      6753.91429068,
      1684.49052453,
      4469.77874625,
      749.48116789,
      3833.22233711,
      2346.92438966,
      19032.89451179,
      743.95852513,
      1813.48047127,
      11819.17896063,
      3803.69575682,
      1329.99090493,
      8443.4853593,
      23245.11025812,
      7998.57315467,
      5786.44298974,
      722.75217754,
      11248.82323152,
      2517.54424886,
      1831.15427009,
      3978.27491216,
      16917.21419844,
      17385.53056473,
      1081.41768852,
      2909.40812372,
      11697.20702803,
      17759.06443565,
      17787.1984882,
      3908.94432127,
      1977.88375373,
      16926.84138066,
      30763.89495916,
      -4408.64775712,
      -11616.83182237,
      -11937.32248077,
      -9712.61644909,
      -16549.35704757,
      -26605.2047639,
      -27049.01438651,
      -6849.71627538,
      -26186.21306959,
      -30108.89435324,
      -2681.47170588,
      -5801.99872221,
      -4872.62209069,
      -839.23079251,
      -2786.76234989,
      -8257.5068167,
      -9317.07444135,
      -443.01632661,
      -1522.96373294,
      -17445.90043647,
      -16365.21985913,
      -1871.66815499,
      -1048.61968876,
      -650.86212123,
      -4773.39366459,
      -8887.13722892,
      23034.6535852,
      -21951.87903776,
      -2513.96112059,
      -4284.12345853,
      -19401.17346998,
      -1791.66894752,
      -15658.49267431,
      -2707.69798258,
      -934.09243246,
      -4541.91898036,
      -2867.50123001,
      -5245.33848759,
      -333.00609631,
      -2107.93919684,
      422.16172415,
      -1612.6303772,
      1083.31522443,
      689.6741814,
      7177.82882125,
      2249.06384548,
      -972.74565067,
      1147.04420259,
      14959.87601843,
      16199.74286302,
      2790.23930278,
      53610.07703268,
      -1167.966326,
      -28374.70190345,
      -29387.63750367,
      -732.10322517,
      -28508.6330133,
      -27414.43885377,
      -23314.88315499,
      -23244.15443602,
      -11844.92756714,
      -10103.73510577,
      -2484.57955839,
      -1106.82489131,
      -11551.6059676,
      -12130.97649627,
      -1900.96497361,
      -3254.62778618,
      -4046.90054103,
      -326.71576892,
      -2365.08565459,
      -1234.22410145,
      -425.96543502,
      2598.75141631,
      486.14237699,
      692.73977257,
      1.8497681,
      -855.78068991,
      5148.38433071,
      11017.05892949,
      6016.49454323,
      32195.80026942,
      2973.94576632,
      30609.45276338,
      4940.56945781,
      10981.44012348,
      1461.95056937,
      -12855.39004301,
      9612.18342661,
      6845.07233712,
      -1365.53717878,
      -126.12604624,
      3400.52826365,
      11057.99427694,
      132.32714647,
      1079.93711163,
      4636.68342679,
      2877.84265994,
      2449.53815379,
      20494.59123853,
      1551.87411571,
      404.12009773,
      -4544.20599288,
      -665.49250083,
      1135.3973928,
      -3366.41194628,
      -2603.15772007,
      -4167.369461,
      -304.31381286,
      378.78279753
    ],
    "models": [
      "A-Class",
      "A-Class 4MATIC",
      "A-Class A 220",
      "A-Class A 220 4MATIC",
      "AMG A 35",
      "AMG A 35 4MATIC",
      "AMG C 43 4MATIC",
      "AMG C 43 AMG C 43 4MATIC",
      "AMG C 63 S",
      "AMG CLA 35",
      "AMG CLA 35 4MATIC",
      "AMG CLA 45 4MATIC",
      "AMG CLA 45 AMG CLA 45 4MATIC",
      "AMG CLS 53 4MATIC",
      "AMG CLS 53 S-Model 4MATIC",
      "AMG E 53",
      "AMG E 53 4MATIC",
      "AMG E 53 E 53 AMG",
      "AMG E 63",
      "AMG E 63 S 4MATIC",
      "AMG EQE",
      "AMG EQE 4MATIC",
      "AMG EQS",
      "AMG G 4MATIC",
      "AMG G 63",
      "AMG G 63 4MATIC",
      "AMG GLA 35",
      "AMG GLA 35 4MATIC",
      "AMG GLA 45",
      "AMG GLA 45 AMG GLA 45",
      "AMG GLB 35",
      "AMG GLB 35 4MATIC",
      "AMG GLC 43 4MATIC",
      "AMG GLC 43 4MATIC Coupe",
      "AMG GLC 63 4MATIC",
      "AMG GLC 63 S 4MATIC",
      "AMG GLE 43",
      "AMG GLE 43 4MATIC",
      "AMG GLE 43 4MATIC Coupe",
      "AMG GLE 43 Coupe 4MATIC",
      "AMG GLE 53",
      "AMG GLE 53 4MATIC",
      "AMG GLE 53 4MATIC Coupe",
      "AMG GLE 53 AMG GLE 53",
      "AMG GLE 63",
      "AMG GLE 63 4MATIC",
      "AMG GLE 63 S",
      "AMG GLE 63 S 4MATIC Coupe",
      "AMG GLE 63 S Coupe 4MATIC",
      "AMG GLE 63 S-Model 4MATIC",
      "AMG GLE 63 S-model",
      "AMG GLE AMG GLE 63 S Coupe 4MATIC",
      "AMG GLS 63",
      "AMG GLS 63 4MATIC",
      "AMG GT",
      "AMG GT 43",
      "AMG GT 43 C",
      "AMG GT 53",
      "AMG GT 53 AMG GT 53",
      "AMG GT 53 C",
      "AMG GT 63",
      "AMG GT 63 4-Door",
      "AMG GT 63 S 4-Door",
      "AMG GT AMG GT 43",
      "AMG GT AMG GT S",
      "AMG GT C",
      "AMG GT R",
      "AMG S 63 4MATIC",
      "AMG S AMG S 63 4MATIC",
      "AMG SL 43 4MATIC+",
      "AMG SL 55",
      "AMG SL 63",
      "AMG SLC 43",
      "C-Class",
      "C-Class 4MATIC",
      "C-Class 4MATIC Coupe",
      "C-Class 4MATIC Sedan",
      "C-Class C 300",
      "C-Class C 300 4MATIC",
      "C-Class Sedan",
      "CLA 250",
      "CLA 250 4MATIC",
      "CLA 250 CLA 250",
      "CLS 450",
      "CLS 450 4MATIC",
      "CLS-Class CLS 550",
      "E-Class",
      "E-Class 4MATIC",
      "E-Class E 300",
      "E-Class E 300 Luxury",
      "E-Class E 300 Sport",
      "E-Class E 350",
      "E-Class E 350 4MATIC",
      "E-Class E 350 Sedan",
      "E-Class E 400",
      "E-Class E 400 4MATIC",
      "E-Class E 450",
      "E-Class E 450 4MATIC",
      "E-Class E 63 AMG 4MATIC",
      "EQB 250",
      "EQB 250 250 4D Sport Utility",
      "EQB 300",
      "EQB 300 4MATIC",
      "EQB 350",
      "EQB 350 4MATIC",
      "EQB 350 EQB 350",
      "EQE 350 350+ Sedan",
      "EQE 350 4MATIC",
      "EQE 350 4MATIC+",
      "EQE 350+",
      "EQE 350+ 350+ SUV",
      "EQE 350+ 350+ Sedan",
      "EQE 500",
      "EQE 500 4MATIC",
      "EQE 500 4MATIC+",
      "EQS 450",
      "EQS 450 4MATIC",
      "EQS 450+",
      "EQS 450+ 450",
      "EQS 450+ 4MATIC",
      "EQS 580 4MATIC",
      "G-Class",
      "G-Class G 550",
      "G-Class G 550 4MATIC",
      "GL-Class GL 450 4MATIC",
      "GLA 250",
      "GLA 250 4MATIC",
      "GLA-Class GLA 250 4MATIC",
      "GLB 250",
      "GLB 250 4MATIC",
      "GLC 300",
      "GLC 300 4MATIC",
      "GLC 300 4MATIC Coupe",
      "GLC 350e 4MATIC",
      "GLC-Class GLC 300",
      "GLC-Class GLC 300 4MATIC",
      "GLE 350",
      "GLE 350 4MATIC",
      "GLE 400 4MATIC",
      "GLE 450",
      "GLE 450 4MATIC",
      "GLE 450 AWD 4MATIC",
      "GLE 450 GLE 450",
      "GLE 450 Plug-In Hybrid 4MATIC",
      "GLE 580 4MATIC",
      "GLE 580 AWD 4MATIC",
      "GLS 450",
      "GLS 450 4MATIC",
      "GLS 550",
      "GLS 550 4MATIC",
      "GLS 580",
      "GLS 580 4MATIC",
      "Maybach GLS 600",
      "Maybach GLS 600 4MATIC",
      "Maybach S 560 4MATIC",
      "Maybach S 580 4MATIC",
      "Maybach S 650",
      "Maybach S 680 4MATIC",
      "Maybach S S 600",
      "Metris",
      "S-Class",
      "S-Class 4MATIC",
      "S-Class S 450",
      "S-Class S 450 4MATIC",
      "S-Class S 500",
      "S-Class S 500 4MATIC",
      "S-Class S 550",
      "S-Class S 550 4MATIC",
      "S-Class S 560",
      "S-Class S 560 4MATIC",
      "S-Class S 580",
      "S-Class S 580 4MATIC",
      "SL 450",
      "SL 550 SL550",
      "SLC 300",
      "SLK-Class SLK 250",